{
    "manifest-version": 3,
    "name": "packageA",
    "slug": "package-a",
    "displayName": "Package A",
    "kind": "plugin",
    "capellApiVersion": "^1.0",
    "version": "1.0.0",
    "description": "Fixture package A for dependency-order tests.",
    "product": { "group": "Tests", "tier": "free", "bundle": null },
    "surfaces": ["console"],
    "dependencies": { "requires": [], "supports": [], "conflicts": [] },
    "providers": {
        "metadata": [],
        "install": [],
        "runtime": [],
        "admin": [],
        "frontend": []
    },
    "contributes": [],
    "database": {
        "migrations": false,
        "settings": false,
        "requiredTables": []
    },
    "commands": {
        "install": "packageA:install",
        "setup": "packageA:setup",
        "demo": null,
        "doctor": null
    },
    "settings": [],
    "permissions": [],
    "capabilities": [],
    "performance": {
        "frontendRenderBudgetMs": 0,
        "adminQueryBudget": 0,
        "cacheTags": [],
        "cacheSafety": {
            "cacheable": false,
            "variesBy": [],
            "sensitiveOutput": false,
            "invalidationSources": [],
            "queueInvalidation": false
        }
    },
    "healthChecks": [],
    "commercial": {
        "proposedLicense": "free",
        "requestedCertification": "community",
        "supportPolicy": "community",
        "privateDocsRequested": false
    },
    "marketplace": {
        "summary": "Package A test fixture.",
        "screenshots": [],
        "categories": ["tests"]
    }
}
