{
    "manifest-version": 3,
    "name": "test",
    "slug": "extension-package",
    "displayName": "Extension Package",
    "kind": "plugin",
    "capellApiVersion": "^1.0",
    "version": "1.0.0",
    "description": "Fixture package for extension command tests.",
    "product": { "group": "Tests", "tier": "free", "bundle": null },
    "surfaces": ["console"],
    "dependencies": { "requires": [], "supports": [], "conflicts": [] },
    "providers": { "metadata": [], "install": [], "runtime": [], "admin": [], "frontend": [] },
    "contributes": [],
    "database": { "migrations": false, "settings": false, "requiredTables": [] },
    "commands": { "install": "test:install", "setup": "test:setup", "demo": "test:demo", "demoParams": ["url"], "faker": "test:faker", "fakerParams": ["sites", "languages"], "doctor": null },
    "settings": [],
    "permissions": [],
    "capabilities": [],
    "performance": { "frontendRenderBudgetMs": 0, "adminQueryBudget": 0, "cacheTags": [], "cacheSafety": { "cacheable": false, "variesBy": [], "sensitiveOutput": false, "invalidationSources": [], "queueInvalidation": false } },
    "healthChecks": [],
    "commercial": { "proposedLicense": "free", "requestedCertification": "community", "supportPolicy": "community", "privateDocsRequested": false },
    "marketplace": { "summary": "Extension command test fixture.", "screenshots": [], "categories": ["tests"] }
}
